{"artifacts":[{"artifact_id":"artifact-436ca422be650fd43a5935b92ce6150111bf38e0580f6142bb7237d06c8c0f53","media_type":"application/json","role":"source","sha256":"436ca422be650fd43a5935b92ce6150111bf38e0580f6142bb7237d06c8c0f53","size_bytes":38,"storage_key":"artifacts/436ca422be650fd43a5935b92ce6150111bf38e0580f6142bb7237d06c8c0f53"}],"episode_id":"synthetic-report-episode","error":null,"job_id":"mri-one","module_id":"mri.anatomy","module_version":"0.1.0","observations":[{"acquired_at":"2026-10-09T09:55:00+03:00","anatomy":{"level":"L4-L5","numbering_status":"needs_confirmation","region":"lumbar_spine","side":"midline"},"assessment_status":"assessed","concept":"spine.canal.cross_sectional_area","coordinate_frame":null,"evidence_refs":[{"artifact_id":"artifact-436ca422be650fd43a5935b92ce6150111bf38e0580f6142bb7237d06c8c0f53","selector":{"kind":"json","pointer":"/value"}}],"method":"fixture-geometry","model":null,"observation_id":"observation-c6abb14ba0386e268907b147522a6fea","origin":"synthetic_demo","quality":"usable","unit":"mm2","value":75}],"result_id":"result-c6b20584b2a0149517815a51e2e2e1a5","schema_version":"1.0","status":"complete","warnings":[]}